{
  "$schema": "https://json-schema.org/draft/2020-12/schema",
  "$id": "urn:genesis-lab:dinosaur:2",
  "title": "Fictional Genesis Lab hybrid export v2",
  "type": "object",
  "additionalProperties": false,
  "required": [
    "schema",
    "version",
    "fictionalLabCreation",
    "creation",
    "battleBlueprint"
  ],
  "properties": {
    "schema": {
      "const": "genesis-lab/dinosaur"
    },
    "version": {
      "const": 2
    },
    "fictionalLabCreation": {
      "const": true
    },
    "creation": {
      "type": "object",
      "additionalProperties": false,
      "required": [
        "id",
        "name",
        "speciesId",
        "traits",
        "appearance",
        "modelVersion",
        "runs",
        "hybrid"
      ],
      "properties": {
        "id": {
          "type": "string",
          "pattern": "^[a-zA-Z0-9-]{1,80}$"
        },
        "name": {
          "type": "string",
          "minLength": 1,
          "maxLength": 40,
          "pattern": "\\S"
        },
        "speciesId": {
          "enum": [
            "compsognathus",
            "gallimimus",
            "stegosaurus",
            "parasaurolophus",
            "triceratops",
            "ankylosaurus",
            "dilophosaurus",
            "velociraptor",
            "pteranodon",
            "brachiosaurus",
            "mosasaurus",
            "spinosaurus",
            "trex",
            "indominus"
          ]
        },
        "traits": {
          "type": "object",
          "additionalProperties": false,
          "required": [
            "tail",
            "legs",
            "mass"
          ],
          "properties": {
            "tail": {
              "type": "number",
              "minimum": 0.6,
              "maximum": 1.6,
              "enum": [
                0.6,
                0.7,
                0.8,
                0.9,
                1,
                1.1,
                1.2,
                1.3,
                1.4,
                1.5,
                1.6
              ]
            },
            "legs": {
              "type": "number",
              "minimum": 0.7,
              "maximum": 1.4,
              "enum": [
                0.7,
                0.8,
                0.9,
                1,
                1.1,
                1.2,
                1.3,
                1.4
              ]
            },
            "mass": {
              "type": "number",
              "minimum": 0.6,
              "maximum": 1.6,
              "enum": [
                0.6,
                0.7,
                0.8,
                0.9,
                1,
                1.1,
                1.2,
                1.3,
                1.4,
                1.5,
                1.6
              ]
            }
          }
        },
        "appearance": {
          "type": "object",
          "additionalProperties": false,
          "required": [
            "color",
            "pattern"
          ],
          "properties": {
            "color": {
              "enum": [
                "sample",
                "mint",
                "coral",
                "violet"
              ]
            },
            "pattern": {
              "enum": [
                "plain",
                "spots",
                "stripes"
              ]
            }
          }
        },
        "modelVersion": {
          "const": "genesis-hybrid-1"
        },
        "runs": {
          "type": "array",
          "minItems": 1,
          "maxItems": 12,
          "items": {
            "type": "object",
            "additionalProperties": false,
            "required": [
              "speciesId",
              "traits",
              "appearance",
              "conditions",
              "seed",
              "modelVersion",
              "result",
              "hybrid"
            ],
            "properties": {
              "speciesId": {
                "enum": [
                  "compsognathus",
                  "gallimimus",
                  "stegosaurus",
                  "parasaurolophus",
                  "triceratops",
                  "ankylosaurus",
                  "dilophosaurus",
                  "velociraptor",
                  "pteranodon",
                  "brachiosaurus",
                  "mosasaurus",
                  "spinosaurus",
                  "trex",
                  "indominus"
                ]
              },
              "traits": {
                "type": "object",
                "additionalProperties": false,
                "required": [
                  "tail",
                  "legs",
                  "mass"
                ],
                "properties": {
                  "tail": {
                    "type": "number",
                    "minimum": 0.6,
                    "maximum": 1.6,
                    "enum": [
                      0.6,
                      0.7,
                      0.8,
                      0.9,
                      1,
                      1.1,
                      1.2,
                      1.3,
                      1.4,
                      1.5,
                      1.6
                    ]
                  },
                  "legs": {
                    "type": "number",
                    "minimum": 0.7,
                    "maximum": 1.4,
                    "enum": [
                      0.7,
                      0.8,
                      0.9,
                      1,
                      1.1,
                      1.2,
                      1.3,
                      1.4
                    ]
                  },
                  "mass": {
                    "type": "number",
                    "minimum": 0.6,
                    "maximum": 1.6,
                    "enum": [
                      0.6,
                      0.7,
                      0.8,
                      0.9,
                      1,
                      1.1,
                      1.2,
                      1.3,
                      1.4,
                      1.5,
                      1.6
                    ]
                  }
                }
              },
              "appearance": {
                "type": "object",
                "additionalProperties": false,
                "required": [
                  "color",
                  "pattern"
                ],
                "properties": {
                  "color": {
                    "enum": [
                      "sample",
                      "mint",
                      "coral",
                      "violet"
                    ]
                  },
                  "pattern": {
                    "enum": [
                      "plain",
                      "spots",
                      "stripes"
                    ]
                  }
                }
              },
              "conditions": {
                "type": "object",
                "additionalProperties": false,
                "required": [
                  "experiment",
                  "track",
                  "turn"
                ],
                "properties": {
                  "experiment": {
                    "enum": [
                      "dash",
                      "balance"
                    ]
                  },
                  "track": {
                    "enum": [
                      "smooth",
                      "grippy",
                      "hurdles"
                    ]
                  },
                  "turn": {
                    "enum": [
                      "gentle",
                      "medium",
                      "sharp"
                    ]
                  }
                }
              },
              "seed": {
                "const": 2718
              },
              "modelVersion": {
                "const": "genesis-hybrid-1"
              },
              "result": {
                "type": "object",
                "additionalProperties": false,
                "required": [
                  "seconds",
                  "cleared",
                  "stability",
                  "explanation"
                ],
                "properties": {
                  "seconds": {
                    "type": "number",
                    "exclusiveMinimum": 0,
                    "maximum": 30
                  },
                  "cleared": {
                    "type": "integer",
                    "minimum": 0,
                    "maximum": 3
                  },
                  "stability": {
                    "enum": [
                      "stable",
                      "wobble",
                      "tumble"
                    ]
                  },
                  "explanation": {
                    "type": "string",
                    "maxLength": 240
                  }
                }
              },
              "hybrid": {
                "type": "object",
                "additionalProperties": false,
                "required": [
                  "donorSpeciesId",
                  "head",
                  "back",
                  "tail"
                ],
                "properties": {
                  "donorSpeciesId": {
                    "enum": [
                      "compsognathus",
                      "gallimimus",
                      "stegosaurus",
                      "parasaurolophus",
                      "triceratops",
                      "ankylosaurus",
                      "dilophosaurus",
                      "velociraptor",
                      "pteranodon",
                      "brachiosaurus",
                      "mosasaurus",
                      "spinosaurus",
                      "trex",
                      "indominus"
                    ]
                  },
                  "head": {
                    "enum": [
                      "base",
                      "donor"
                    ]
                  },
                  "back": {
                    "enum": [
                      "base",
                      "donor"
                    ]
                  },
                  "tail": {
                    "enum": [
                      "base",
                      "donor"
                    ]
                  }
                }
              }
            }
          }
        },
        "hybrid": {
          "type": "object",
          "additionalProperties": false,
          "required": [
            "donorSpeciesId",
            "head",
            "back",
            "tail"
          ],
          "properties": {
            "donorSpeciesId": {
              "enum": [
                "compsognathus",
                "gallimimus",
                "stegosaurus",
                "parasaurolophus",
                "triceratops",
                "ankylosaurus",
                "dilophosaurus",
                "velociraptor",
                "pteranodon",
                "brachiosaurus",
                "mosasaurus",
                "spinosaurus",
                "trex",
                "indominus"
              ]
            },
            "head": {
              "enum": [
                "base",
                "donor"
              ]
            },
            "back": {
              "enum": [
                "base",
                "donor"
              ]
            },
            "tail": {
              "enum": [
                "base",
                "donor"
              ]
            }
          }
        }
      }
    },
    "battleBlueprint": {
      "type": "object",
      "additionalProperties": false,
      "required": [
        "game",
        "status",
        "parents",
        "anatomy",
        "features",
        "colors",
        "stats",
        "statBudget",
        "suggestedBaseRosterId",
        "unresolvedSpeciesIds",
        "implementationRequired"
      ],
      "properties": {
        "game": {
          "const": "Dinosaur_Battle"
        },
        "status": {
          "const": "design-reference"
        },
        "parents": {
          "type": "array",
          "minItems": 2,
          "maxItems": 2,
          "items": {
            "type": "object",
            "additionalProperties": false,
            "required": [
              "speciesId",
              "name"
            ],
            "properties": {
              "speciesId": {
                "enum": [
                  "compsognathus",
                  "gallimimus",
                  "stegosaurus",
                  "parasaurolophus",
                  "triceratops",
                  "ankylosaurus",
                  "dilophosaurus",
                  "velociraptor",
                  "pteranodon",
                  "brachiosaurus",
                  "mosasaurus",
                  "spinosaurus",
                  "trex",
                  "indominus"
                ]
              },
              "name": {
                "type": "string",
                "minLength": 1,
                "maxLength": 80
              }
            }
          }
        },
        "anatomy": {
          "type": "object",
          "additionalProperties": false,
          "required": [
            "body",
            "head",
            "back",
            "tail"
          ],
          "properties": {
            "body": {
              "enum": [
                "compsognathus",
                "gallimimus",
                "stegosaurus",
                "parasaurolophus",
                "triceratops",
                "ankylosaurus",
                "dilophosaurus",
                "velociraptor",
                "pteranodon",
                "brachiosaurus",
                "mosasaurus",
                "spinosaurus",
                "trex",
                "indominus"
              ]
            },
            "head": {
              "enum": [
                "compsognathus",
                "gallimimus",
                "stegosaurus",
                "parasaurolophus",
                "triceratops",
                "ankylosaurus",
                "dilophosaurus",
                "velociraptor",
                "pteranodon",
                "brachiosaurus",
                "mosasaurus",
                "spinosaurus",
                "trex",
                "indominus"
              ]
            },
            "back": {
              "enum": [
                "compsognathus",
                "gallimimus",
                "stegosaurus",
                "parasaurolophus",
                "triceratops",
                "ankylosaurus",
                "dilophosaurus",
                "velociraptor",
                "pteranodon",
                "brachiosaurus",
                "mosasaurus",
                "spinosaurus",
                "trex",
                "indominus"
              ]
            },
            "tail": {
              "enum": [
                "compsognathus",
                "gallimimus",
                "stegosaurus",
                "parasaurolophus",
                "triceratops",
                "ankylosaurus",
                "dilophosaurus",
                "velociraptor",
                "pteranodon",
                "brachiosaurus",
                "mosasaurus",
                "spinosaurus",
                "trex",
                "indominus"
              ]
            }
          }
        },
        "features": {
          "type": "array",
          "minItems": 3,
          "maxItems": 3,
          "items": {
            "type": "object",
            "additionalProperties": false,
            "required": [
              "part",
              "sourceSpeciesId",
              "description"
            ],
            "properties": {
              "part": {
                "enum": [
                  "head",
                  "back",
                  "tail"
                ]
              },
              "sourceSpeciesId": {
                "enum": [
                  "compsognathus",
                  "gallimimus",
                  "stegosaurus",
                  "parasaurolophus",
                  "triceratops",
                  "ankylosaurus",
                  "dilophosaurus",
                  "velociraptor",
                  "pteranodon",
                  "brachiosaurus",
                  "mosasaurus",
                  "spinosaurus",
                  "trex",
                  "indominus"
                ]
              },
              "description": {
                "type": "string",
                "minLength": 1,
                "maxLength": 80
              }
            }
          }
        },
        "colors": {
          "type": "object",
          "additionalProperties": false,
          "required": [
            "body",
            "accent",
            "pattern"
          ],
          "properties": {
            "body": {
              "type": "string",
              "pattern": "^#[0-9a-fA-F]{6}$"
            },
            "accent": {
              "type": "string",
              "pattern": "^#[0-9a-fA-F]{6}$"
            },
            "pattern": {
              "enum": [
                "plain",
                "spots",
                "stripes"
              ]
            }
          }
        },
        "stats": {
          "type": "object",
          "additionalProperties": false,
          "required": [
            "power",
            "armor",
            "speed",
            "agility",
            "stamina",
            "reach"
          ],
          "properties": {
            "power": {
              "type": "integer",
              "minimum": 1,
              "maximum": 9
            },
            "armor": {
              "type": "integer",
              "minimum": 1,
              "maximum": 9
            },
            "speed": {
              "type": "integer",
              "minimum": 1,
              "maximum": 9
            },
            "agility": {
              "type": "integer",
              "minimum": 1,
              "maximum": 9
            },
            "stamina": {
              "type": "integer",
              "minimum": 1,
              "maximum": 9
            },
            "reach": {
              "type": "integer",
              "minimum": 1,
              "maximum": 9
            }
          }
        },
        "statBudget": {
          "type": "object",
          "additionalProperties": false,
          "required": [
            "min",
            "max",
            "total"
          ],
          "properties": {
            "min": {
              "const": 1
            },
            "max": {
              "const": 9
            },
            "total": {
              "const": 30
            }
          }
        },
        "suggestedBaseRosterId": {
          "enum": [
            "trex",
            "spinosaurus",
            "stegosaurus",
            "ankylosaurus",
            "triceratops",
            "custom"
          ]
        },
        "unresolvedSpeciesIds": {
          "type": "array",
          "minItems": 0,
          "maxItems": 2,
          "items": {
            "enum": [
              "compsognathus",
              "gallimimus",
              "stegosaurus",
              "parasaurolophus",
              "triceratops",
              "ankylosaurus",
              "dilophosaurus",
              "velociraptor",
              "pteranodon",
              "brachiosaurus",
              "mosasaurus",
              "spinosaurus",
              "trex",
              "indominus"
            ]
          }
        },
        "implementationRequired": {
          "const": true
        }
      }
    }
  }
}
